{"$schema":"https://json-schema.org/draft/2020-12/schema","$id":"https://actiongate.dev/contracts/evidence/c01/profile-dispatch-receipt-v2.json","title":"ActionGate C01 profile shadow dispatch receipt","type":"object","additionalProperties":false,"required":["schema","repository","issue","dispatch_pr","state","dispatch_candidate","hosted_workflow","changed_paths","independent_review","c01_admitted","k01_started","evidence_ceiling","human_owned"],"properties":{"schema":{"const":"actiongate-c01-profile-dispatch-receipt/v2"},"repository":{"const":"ed3c/ActionGate"},"issue":{"const":60},"dispatch_pr":{"type":"integer","minimum":1},"state":{"const":"C01_PROFILE_HARDENED_SHADOW_DISPATCH_READY_FOR_EXTERNAL_REVIEW"},"dispatch_candidate":{"type":"object","additionalProperties":false,"required":["commit","tree"],"properties":{"commit":{"type":"string","pattern":"^[0-9a-f]{40}$"},"tree":{"type":"string","pattern":"^[0-9a-f]{40}$"}}},"hosted_workflow":{"type":"object","additionalProperties":false,"required":["name","run_id","job_id","head_sha","conclusion"],"properties":{"name":{"const":"C01 Profile Shadow Dispatch"},"run_id":{"type":"integer","minimum":1},"job_id":{"type":"integer","minimum":1},"head_sha":{"type":"string","pattern":"^[0-9a-f]{40}$"},"conclusion":{"const":"success"}}},"changed_paths":{"type":"array","minItems":1,"items":{"type":"string"}},"independent_review":{"const":"NOT_EXERCISED"},"c01_admitted":{"const":false},"k01_started":{"const":false},"evidence_ceiling":{"const":"profile-hardened independent-review dispatch only"},"human_owned":{"type":"array","contains":{"const":"merge"}}}}
